job_title,link,recommendation
PLM Engineering Data Engineer (m/w/d),https://www.rheinmetall.com/en/job/plm_engineering_data_engineer__m_w_d_/817055,CV_A
Siemens System Administrator F-35 (m/w/d),https://www.rheinmetall.com/en/job/siemens_system_administrator_f_35__m_w_d_/800210,CV_A
Engineering Data Exchange Specialist (m/w/d),https://www.rheinmetall.com/en/job/engineering_data_exchange_specialist__m_w_d_/852590,CV_A
Shopfloor (BDE) IT Software Engineer (m/w/d),https://www.rheinmetall.com/en/job/shopfloor__bde__it_software_engineer__m_w_d_/962984,CV_A
PLM Engineering Data Analyst (m/f/d),https://www.rheinmetall.com/en/job/plm_engineering_data_analyst__m_f_d_/1057607,CV_A

